{
  "$schema": "https://json-schema.org/draft/2020-12/schema",
  "title": "Private Capital Atlas Person Content Schema v1",
  "type": "object",
  "required": [
    "entity",
    "title",
    "summary",
    "sections",
    "data_quality",
    "last_reviewed"
  ],
  "properties": {
    "entity": {
      "type": "string",
      "pattern": "^person:[a-z0-9]+(?:-[a-z0-9]+)*$"
    },
    "title": {
      "type": "object",
      "required": ["fa", "en"],
      "properties": {
        "fa": {"type": "string", "minLength": 1},
        "en": {"type": "string", "minLength": 1}
      },
      "additionalProperties": false
    },
    "summary": {
      "type": "string",
      "minLength": 1
    },
    "sections": {
      "type": "array",
      "items": {
        "$ref": "#/$defs/section"
      }
    },
    "data_quality": {
      "$ref": "#/$defs/dataQuality"
    },
    "last_reviewed": {
      "type": "string",
      "pattern": "^(13|14)\\d{2}-(0[1-9]|1[0-2])$"
    }
  },
  "additionalProperties": false,
  "$defs": {
    "section": {
      "type": "object",
      "required": [
        "id",
        "title_fa",
        "title_en",
        "paragraphs"
      ],
      "properties": {
        "id": {
          "type": "string",
          "minLength": 1
        },
        "title_fa": {
          "type": "string",
          "minLength": 1
        },
        "title_en": {
          "type": "string",
          "minLength": 1
        },
        "paragraphs": {
          "type": "array",
          "items": {
            "$ref": "#/$defs/paragraph"
          }
        }
      },
      "additionalProperties": false
    },
    "paragraph": {
      "type": "object",
      "required": [
        "text",
        "sourceRefs"
      ],
      "properties": {
        "text": {
          "type": "string",
          "minLength": 1
        },
        "sourceRefs": {
          "type": "array",
          "items": {
            "type": "string",
            "pattern": "^source:[a-z0-9]+(?:-[a-z0-9]+)*$"
          },
          "uniqueItems": true
        }
      },
      "additionalProperties": false
    },
    "dataQuality": {
      "type": "object",
      "required": [
        "title_fa",
        "text"
      ],
      "properties": {
        "title_fa": {
          "type": "string",
          "minLength": 1
        },
        "text": {
          "type": "string",
          "minLength": 1
        }
      },
      "additionalProperties": false
    }
  }
}
