{
  "entity": "person:ali-sanginian",
  "title": {
    "fa": "علی سنگینیان",
    "en": "Ali Sanginian"
  },
  "summary": "علی سنگینیان از مدیران و فعالان باسابقه بازار سرمایه ایران است که سابقه فعالیت در حوزه‌های بازار سرمایه، تأمین مالی، بانکداری سرمایه‌گذاری، سرمایه‌گذاری و مدیریت سرمایه‌گذاری را دارد. او در مقاطع مختلف در سمت‌های اجرایی و هیئت‌مدیره‌ای در نهادهای مالی و شرکت‌های ایرانی فعالیت کرده و در سال‌های اخیر نیز در حوزه سرمایه‌گذاری شرکتی و سرمایه‌گذاری خصوصی (Private Equity) فعال بوده است.",
  "sections": [
    {
      "id": "current-position",
      "title_fa": "سمت فعلی",
      "title_en": "Current Position",
      "paragraphs": [
        {
          "text": "سنگینیان در حال حاضر مدیرعامل شرکت مدیریت سهام خصوصی کیان است و فعالیت این مجموعه در حوزه Private Equity را هدایت می‌کند. بر اساس اظهارات او، فعالیت این مجموعه در این حوزه از سال ۱۴۰۵ آغاز شده و با هدف تکمیل زنجیره خدمات سرمایه‌گذاری کیان و ایفای نقش در تشکیل سرمایه و تأمین مالی پروژه‌ها توسعه یافته است.",
          "sourceRefs": [
            "source:kian-direct-interview-1405"
          ]
        }
      ]
    },
    {
      "id": "career",
      "title_fa": "مسیر حرفه‌ای",
      "title_en": "Career",
      "paragraphs": [
        {
          "text": "سنگینیان فعالیت حرفه‌ای خود را در بازار سرمایه آغاز کرد و در سال‌های ابتدایی فعالیت خود در حوزه مطالعات اقتصادی و برنامه‌ریزی بازار سرمایه فعالیت داشت. در ادامه، در مرکز تحقیقات و توسعه بازار سرمایه و سپس در ساختارهای مرتبط با بورس و بازار سرمایه، مسئولیت‌های اجرایی و مدیریتی بر عهده گرفت.",
          "sourceRefs": [
            "source:ali-sanginian-personal-website"
          ]
        },
        {
          "text": "او در بورس تهران در حوزه‌هایی از جمله مطالعات اقتصادی و توسعه بازار و امور ناشران و اعضا فعالیت داشته و در مقطعی نیز سمت دبیر هیئت‌مدیره بورس تهران را بر عهده داشته است.",
          "sourceRefs": [
            "source:ali-sanginian-personal-website"
          ]
        },
        {
          "text": "در ادامه مسیر حرفه‌ای، سنگینیان در هیئت‌مدیره برخی نهادهای بازار سرمایه از جمله فرابورس ایران نیز حضور داشته است.",
          "sourceRefs": [
            "source:ali-sanginian-personal-website"
          ]
        }
      ]
    },
    {
      "id": "investment-banking",
      "title_fa": "تأمین سرمایه و بانکداری سرمایه‌گذاری",
      "title_en": "Investment Banking",
      "paragraphs": [
        {
          "text": "یکی از مهم‌ترین دوره‌های حرفه‌ای سنگینیان، مدیریت در شرکت تأمین سرمایه امین بود. منابع منتشرشده در دوره مدیریت او، وی را مدیرعامل این شرکت معرفی می‌کنند.",
          "sourceRefs": [
            "source:amin-capital-market-report-1395",
            "source:amin-capital-archive"
          ]
        },
        {
          "text": "در این دوره، تأمین مالی از طریق بازار سرمایه، توسعه ابزارهای مالی و موضوع ادغام و تملیک از جمله حوزه‌هایی بود که در فعالیت‌های این شرکت مورد توجه قرار گرفت. در یکی از گزارش‌های منتشرشده در سال ۱۳۹۵، سنگینیان به‌عنوان مدیرعامل تأمین سرمایه امین درباره راه‌اندازی صندوق پروژه، انتشار اوراق و توسعه فعالیت‌های ادغام و تملیک این شرکت توضیح داده است.",
          "sourceRefs": [
            "source:amin-capital-market-report-1395"
          ]
        },
        {
          "text": "او همچنین در یادداشتی که در وب‌سایت شخصی خود منتشر کرده، دوره مدیریت خود در تأمین سرمایه امین را با راه‌اندازی و اداره صندوق توسعه بازار سرمایه مرتبط دانسته است.",
          "sourceRefs": [
            "source:ali-sanginian-personal-articles"
          ]
        }
      ]
    },
    {
      "id": "tourism-bank",
      "title_fa": "حضور در هیئت‌مدیره بانک گردشگری",
      "title_en": "Tourism Bank Board",
      "paragraphs": [
        {
          "text": "سنگینیان در چند مقطع در ترکیب هیئت‌مدیره بانک گردشگری حضور داشته است. داده‌های تاریخی ترکیب هیئت‌مدیره بانک، نام او را به‌عنوان عضو هیئت‌مدیره در سال‌های مختلف، از جمله ۱۳۹۲، ۱۳۹۳، ۱۳۹۶ و ۱۳۹۷، ثبت کرده‌اند.",
          "sourceRefs": [
            "source:tourism-bank-board-history"
          ]
        },
        {
          "text": "در برخی از سوابق تاریخی هیئت‌مدیره بانک گردشگری، نام اشخاص حقوقی نیز در کنار اعضای هیئت‌مدیره آمده است؛ ازاین‌رو برای تعیین دقیق رابطه نمایندگی حقوقی هر دوره، باید به اسناد ثبتی همان دوره مراجعه کرد.",
          "sourceRefs": [
            "source:tourism-bank-board-history"
          ]
        }
      ]
    },
    {
      "id": "tehran-chamber",
      "title_fa": "نقش در اتاق تهران",
      "title_en": "Tehran Chamber",
      "paragraphs": [
        {
          "text": "سنگینیان در دهه ۱۳۹۰ ریاست کمیسیون بازار پول و سرمایه اتاق بازرگانی تهران را بر عهده داشت. گزارش‌ها و مصاحبه‌های منتشرشده در آن دوره، او را با این عنوان معرفی کرده‌اند.",
          "sourceRefs": [
            "source:ali-sanginian-interviews",
            "source:tehran-chamber-independent-report"
          ]
        },
        {
          "text": "در این جایگاه، او درباره موضوعاتی از جمله تأمین مالی بنگاه‌ها، بازار سرمایه، سرمایه‌گذاری خارجی، نظام بانکی و چالش‌های تأمین مالی اقتصاد ایران اظهار نظر کرده است.",
          "sourceRefs": [
            "source:ali-sanginian-interviews",
            "source:tehran-chamber-independent-report"
          ]
        }
      ]
    },
    {
      "id": "kayson",
      "title_fa": "فعالیت در گروه کیسون",
      "title_en": "Kayson Group",
      "paragraphs": [
        {
          "text": "سنگینیان در سال‌های بعد وارد حوزه سرمایه‌گذاری شرکتی شد و به‌عنوان معاون سرمایه‌گذاری گروه کیسون فعالیت کرد. این سمت در منابع رسمی منتشرشده توسط کیسون نیز برای او ذکر شده است.",
          "sourceRefs": [
            "source:kayson-official"
          ]
        },
        {
          "text": "در این دوره، فعالیت او در ارزیابی و توسعه سرمایه‌گذاری‌های گروه کیسون در حوزه‌های مختلف از جمله خدمات مالی، معدن، انرژی و انرژی‌های تجدیدپذیر، بازرگانی، ساخت و توسعه مسکن، نفت و کسب‌وکارهای دانش‌بنیان و استارتاپ‌ها مطرح شده است.",
          "sourceRefs": [
            "source:kayson-official"
          ]
        },
        {
          "text": "یکی از نمونه‌های مستند این فعالیت، سرمایه‌گذاری گروه کیسون در گروه آچاره است. کیسون در اطلاع‌رسانی رسمی خود، مبلغ این سرمایه‌گذاری را ۷۲۰ میلیارد ریال اعلام کرده و سنگینیان را به‌عنوان معاون سرمایه‌گذاری گروه معرفی کرده است.",
          "sourceRefs": [
            "source:kayson-official"
          ]
        },
        {
          "text": "نکته مهم در این رابطه آن است که سرمایه‌گذار، گروه کیسون بوده است، نه شخص علی سنگینیان؛ نقش سنگینیان در این رویداد، نقش مدیریتی و سرمایه‌گذاری در ساختار کیسون بوده است.",
          "sourceRefs": [
            "source:kayson-official"
          ]
        }
      ]
    },
    {
      "id": "private-equity",
      "title_fa": "ورود به حوزه Private Equity",
      "title_en": "Private Equity",
      "paragraphs": [
        {
          "text": "در سال ۱۴۰۵، سنگینیان در مقام مدیرعامل شرکت مدیریت سهام خصوصی کیان، فعالیت این مجموعه در حوزه Private Equity را تشریح کرد. به گفته او، این فعالیت با هدف ایجاد مکملی برای فعالیت‌های بازار عمومی کیان و مشارکت در تشکیل سرمایه و تأمین مالی پروژه‌ها شکل گرفته است.",
          "sourceRefs": [
            "source:kian-direct-interview-1405"
          ]
        },
        {
          "text": "نخستین پروژه اعلام‌شده این مجموعه، یک پروژه ساختمانی مسکونی بوده است. سنگینیان انتخاب این حوزه را با شناخت بیشتر سرمایه‌گذاران از بازار مسکن، سادگی نسبی ساختار پروژه و امکان تسهیل فرآیند تأمین منابع توضیح داده است.",
          "sourceRefs": [
            "source:kian-direct-interview-1405"
          ]
        },
        {
          "text": "بر اساس اظهارات او، در فروردین و اردیبهشت ۱۴۰۵ حدود ۵.۵ همت تأمین مالی برای این پروژه انجام شده و پروژه از ابتدای خرداد وارد مرحله اجرایی شده است.",
          "sourceRefs": [
            "source:kian-direct-interview-1405"
          ]
        }
      ]
    },
    {
      "id": "pipeline",
      "title_fa": "پروژه‌های در دست بررسی",
      "title_en": "Investment Pipeline",
      "paragraphs": [
        {
          "text": "در حوزه انرژی‌های تجدیدپذیر نیز پروژه‌هایی در دست بررسی و توسعه قرار دارند. بر اساس اظهارات سنگینیان، مجموعه این پروژه‌ها در حوزه‌های بادی و خورشیدی نزدیک به ۲۰۰ مگاوات ظرفیت دارند و ارزش آنها حدود ۹۰ میلیون دلار برآورد شده است.",
          "sourceRefs": [
            "source:kian-direct-interview-1405"
          ]
        },
        {
          "text": "او همچنین از بررسی پروژه‌هایی در حوزه گردشگری خبر داده و رویکرد کیان را شناسایی صنایعی با ظرفیت ایجاد بازدهی جذاب و سپس بررسی پروژه‌های مناسب برای سرمایه‌گذاری در آنها توصیف کرده است.",
          "sourceRefs": [
            "source:kian-direct-interview-1405"
          ]
        },
        {
          "text": "این پروژه‌ها باید در Atlas به‌عنوان Investment Pipeline / پروژه‌های در دست بررسی و توسعه ثبت شوند و تا زمان تحقق سرمایه‌گذاری یا آغاز رسمی پروژه، به‌عنوان سرمایه‌گذاری قطعی‌شده معرفی نشوند.",
          "sourceRefs": [
            "source:kian-direct-interview-1405"
          ]
        }
      ]
    },
    {
      "id": "approach",
      "title_fa": "رویکرد سرمایه‌گذاری",
      "title_en": "Investment Approach",
      "paragraphs": [
        {
          "text": "بر اساس توضیحات سنگینیان، سرمایه‌گذاران هدف فعالیت Private Equity کیان عمدتاً سرمایه‌گذاران بزرگ و نهادی، برخی مشتریان فعلی کیان، Family Officeها، خانواده‌های دارای منابع مالی قابل توجه، شرکت‌های بزرگ، کسب‌وکارهای دارای منابع مازاد و شرکت‌های بیمه هستند.",
          "sourceRefs": [
            "source:kian-direct-interview-1405"
          ]
        },
        {
          "text": "او همچنین بر اهمیت انتخاب صنعت و پروژه، ساختاردهی مالی و امکان خروج سرمایه‌گذار پیش از آغاز فرآیند Fundraising تأکید کرده است.",
          "sourceRefs": [
            "source:kian-direct-interview-1405"
          ]
        }
      ]
    },
    {
      "id": "conclusion",
      "title_fa": "جمع‌بندی",
      "title_en": "Conclusion",
      "paragraphs": [
        {